{
  "schemaVersion": 2,
  "artifactType": "migration-result",
  "skill": "migrate-flow",
  "skillVersion": "0.5.0",
  "runId": "demo-line-drawer-migration-001",
  "flowId": "demo-line-drawer",
  "status": "completed",
  "flowContract": {
    "path": "examples\\handoff\\demo-line-drawer\\flow-contract.json",
    "sha256": "ae2013c2a8b14e5cc8be30421c4d4a1d92ed071d2c7a21e55aafd3f02d52f7fb"
  },
  "repository": {
    "root": "C:\\Example\\frontend",
    "revisionBefore": "0123456789abcdef0123456789abcdef01234567",
    "revisionAfter": "0123456789abcdef0123456789abcdef01234567"
  },
  "changedPaths": [
    "src/features/demo-line-drawer/Drawer.ts"
  ],
  "validation": [
    {
      "command": "npm run test -- Drawer.test.ts",
      "status": "passed",
      "summary": "Targeted test passed."
    },
    {
      "command": "npm run typecheck",
      "status": "passed",
      "summary": "Typecheck passed."
    },
    {
      "command": "npm run build",
      "status": "passed",
      "summary": "Build passed."
    }
  ],
  "coverageDelta": {
    "status": "measured",
    "summary": "The selected flow is covered by the targeted test."
  },
  "rollback": {
    "status": "available",
    "instructions": "Revert only the declared changed path."
  },
  "limitations": [],
  "checkpoints": [
    {
      "milestone": "angular-drawer",
      "status": "committed",
      "commitSha": "abcdef1234567890abcdef1234567890abcdef12",
      "subject": "TP522512: migrate selected line detail drawer",
      "paths": [
        "src/features/demo-line-drawer/Drawer.ts"
      ],
      "validationSummary": "Targeted drawer tests passed before the checkpoint."
    }
  ]
}
